{
  "$schema": "./resume.schema.json",
  "certifications": [
    {
      "labels": [
        "marriott"
      ],
      "name": "CompTIA A+ fundamentals - [studying]",
      "url": "https://www.comptia.org/certifications/a",
      "year": 2026
    },
    {
      "labels": [
        "default",
        "backend",
        "devops",
        "marriott",
        "fullstack",
        "business-card"
      ],
      "name": "Databricks Data Engineer Associate",
      "url": "https://credentials.databricks.com/profile/carlosferreyra/wallet",
      "year": 2025
    },
    {
      "labels": [
        "default",
        "backend",
        "marriott",
        "fullstack",
        "business-card"
      ],
      "name": "SQL Advanced",
      "url": "https://www.kaggle.com/learn/certification/eduferreyraok/advanced-sql",
      "year": 2025
    },
    {
      "labels": [
        "default",
        "backend",
        "marriott",
        "fullstack",
        "business-card"
      ],
      "name": "MongoDB - Database Administration",
      "url": "https://learn.mongodb.com/c/OE3lXL2WRfa33hpCBtCwEQ",
      "year": 2025
    },
    {
      "labels": [
        "default",
        "backend",
        "fullstack",
        "business-card"
      ],
      "name": "Oracle Next Education Program",
      "url": "https://app.aluracursos.com/program/certificate/4fd8c5a8-9a27-4d31-b4e5-0ddc4a739e51",
      "year": 2025
    },
    {
      "labels": [
        "default",
        "devops"
      ],
      "name": "Amazon Cloud Practitioner Essentials",
      "url": "https://drive.google.com/file/d/1NqapZG2uenlclXVaJOKurjd5H_WZNHMW/view",
      "year": 2024
    },
    {
      "labels": [
        "default",
        "backend",
        "devops",
        "marriott",
        "fullstack"
      ],
      "name": "Google Associate Cloud Engineer",
      "url": "https://www.credly.com/badges/6347777b-1952-426b-95f0-daadbaccf8e0/linked_in_profile",
      "year": 2024
    },
    {
      "labels": [
        "archive"
      ],
      "name": "Advanced SQL",
      "url": "https://www.kaggle.com/learn/certification/eduferreyraok/advanced-sql",
      "year": 2025
    },
    {
      "labels": [
        "espanol"
      ],
      "name": "MongoDB - DBA",
      "url": "https://learn.mongodb.com/c/OE3lXL2WRfa33hpCBtCwEQ",
      "year": 2025
    },
    {
      "labels": [
        "espanol"
      ],
      "name": "Programa Oracle Next Education",
      "url": "https://app.aluracursos.com/program/certificate/4fd8c5a8-9a27-4d31-b4e5-0ddc4a739e51",
      "year": 2025
    },
    {
      "labels": [
        "espanol"
      ],
      "name": "GCP: Associate Cloud Engineer",
      "url": "https://www.credly.com/badges/6347777b-1952-426b-95f0-daadbaccf8e0/linked_in_profile",
      "year": 2024
    },
    {
      "labels": [
        "archive"
      ],
      "name": "Cloud Practitioner Essentials",
      "url": "https://drive.google.com/file/d/1NqapZG2uenlclXVaJOKurjd5H_WZNHMW/view",
      "year": 2024
    },
    {
      "labels": [
        "espanol"
      ],
      "name": "Databricks: Lakehouse",
      "url": "https://credentials.databricks.com/bc486b63-4c79-4a11-8cb3-ff4b5dee1040",
      "year": 2024
    }
  ],
  "education": [
    {
      "degree": "Information Systems Engineering",
      "highlights": [
        {
          "labels": [
            "default",
            "backend",
            "devops",
            "marriott",
            "fullstack",
            "business-card"
          ],
          "text": "Relevant coursework: Data Structures, Algorithms, Software Engineering, Databases"
        }
      ],
      "institution": "Universidad Tecnologica Nacional",
      "labels": [
        "default",
        "backend",
        "devops",
        "marriott",
        "fullstack",
        "business-card",
        "hospitality"
      ],
      "location": "Argentina",
      "period": "2015 - 2024"
    },
    {
      "degree": "Ingenieria en Sistemas de Informacion",
      "highlights": [],
      "institution": "Universidad Tecnologica Nacional",
      "labels": [
        "espanol"
      ],
      "location": "Argentina",
      "period": "2015 - 2024"
    }
  ],
  "experience": [
    {
      "company": "St. Regis - Marriott",
      "highlights": [
        {
          "labels": [
            "marriott"
          ],
          "text": "Supported Marriott luxury operations across kitchen, bar, private dining, and overnight service teams in a high-expectation guest environment."
        },
        {
          "labels": [
            "marriott"
          ],
          "text": "Worked daily with POS/service systems and understands the impact of downtime, access issues, hardware failures, and delayed IT escalation on guest-facing teams."
        },
        {
          "labels": [
            "hospitality"
          ],
          "text": "Delivered personalized bilingual overnight service to hotel guests, resolving special requests and coordinating with other departments."
        },
        {
          "labels": [
            "hospitality"
          ],
          "text": "Managed overnight In-Room Dining operations independently, including guest communication, order accuracy, service coordination, and follow-through."
        }
      ],
      "labels": [
        "marriott",
        "hospitality"
      ],
      "location": "Aspen",
      "period": "2025-2026",
      "title": "Server | Private Dining"
    },
    {
      "company": "UTN - FRRe",
      "highlights": [
        {
          "labels": [
            "default",
            "backend",
            "devops",
            "fullstack",
            "business-card"
          ],
          "text": "Worked in a team of 6+ people building an ED Platform that helped automate tasks, optimize processes, and maximize productivity"
        },
        {
          "labels": [
            "marriott"
          ],
          "text": "Improved server architecture, automated workflows, and reliability for an internal operations platform supporting hundreds of users."
        },
        {
          "labels": [
            "default",
            "marriott"
          ],
          "text": "Mapped manual processes with non-technical stakeholders, documented constraints, and helped reduce costs 10% while increasing efficiency 50%."
        },
        {
          "labels": [
            "default",
            "backend",
            "devops",
            "fullstack",
            "business-card"
          ],
          "text": "Designed and implemented a scalable server architecture and automated workflows to support hundreds of users"
        },
        {
          "labels": [
            "default",
            "backend",
            "devops",
            "fullstack",
            "business-card"
          ],
          "text": "Collaborated with the financial department to streamline operational processes, resulting in a 10% reduction in costs and a 50% increase in efficiency"
        }
      ],
      "labels": [
        "default",
        "backend",
        "devops",
        "marriott",
        "fullstack",
        "business-card"
      ],
      "location": "Argentina",
      "period": "March 2024 - Dec 2024",
      "title": "Software Engineer"
    },
    {
      "company": "Devlights S.R.L",
      "highlights": [
        {
          "labels": [
            "default",
            "backend",
            "fullstack",
            "business-card"
          ],
          "text": "Collaborated with a team of 4+ interns and mentors to develop a website for an ISP company"
        },
        {
          "labels": [
            "marriott"
          ],
          "text": "Troubleshot and implemented REST API workflows for customer data collection using Python, Django, Git, and web APIs."
        },
        {
          "labels": [
            "default",
            "backend",
            "fullstack",
            "business-card"
          ],
          "text": "Implemented a REST-API to automate data collection of the customer"
        },
        {
          "labels": [
            "default",
            "backend",
            "fullstack",
            "business-card"
          ],
          "text": "Gained hands-on experience with Python, Git, Django, Web APIs and applied them to a web application"
        }
      ],
      "labels": [
        "default",
        "backend",
        "marriott",
        "fullstack",
        "business-card"
      ],
      "location": "Argentina",
      "period": "March 2021 - Sep 2021",
      "title": "Backend Engineer"
    },
    {
      "company": "UTN - FRRe",
      "highlights": [
        {
          "labels": [
            "espanol"
          ],
          "text": "Trabaje en un equipo de mas de 6 personas construyendo una plataforma ED que ayudo a automatizar tareas, optimizar procesos y maximizar la productividad."
        },
        {
          "labels": [
            "espanol"
          ],
          "text": "Disene e implemente una arquitectura de servidor escalable y flujos de trabajo automatizados para dar soporte a cientos de usuarios."
        },
        {
          "labels": [
            "espanol"
          ],
          "text": "Disene e implemente una solucion de base de datos para interconectar servidores de la organizacion con el nuevo sistema, siguiendo normas de seguridad y calidad."
        }
      ],
      "labels": [
        "espanol"
      ],
      "location": "Argentina",
      "period": "2024-2025",
      "title": "Backend Engineer"
    },
    {
      "company": "Devlights S.R.L",
      "highlights": [
        {
          "labels": [
            "espanol"
          ],
          "text": "Implemente una API REST para automatizar la recopilacion de datos del cliente."
        },
        {
          "labels": [
            "espanol"
          ],
          "text": "Adquiri experiencia practica con Python, Git, Django y APIs web, aplicandolos a una aplicacion web."
        }
      ],
      "labels": [
        "espanol"
      ],